order_id,review_comment_title,review_comment_message,message_ko,title_ko
1446f87ab63443ca948c7faa3d7ef194,,"Do total de 2 produtos foi entregue apenas um, e o outro até o presente momento nada ( 21/11/2017)","총 2개의 상품 중 1개만 배송되었고, 나머지 1개는 현재까지 배송되지 않았습니다. (2017.11.21)",
0dcbdac8c6463d75e774a3ba98d11561,,o produto recebido veio errado,받은 제품이 잘못왔어요,
855632576dae35f0e89fa6c955282642,,Eu não recebi a bolsa alguém pode me ajudar ,장학금을 받지 못했습니다. 누가 도와주실 수 있나요?,
0cc9e18508708774c1c956cd3ad9e910,,Produto não foi entregue na data do combinado.,약속한 날짜에 제품이 배송되지 않았습니다.,
5f064781620790a450c0308f09adfd8d,,"sem comentarios ja disse o q penso em email anterior , só coloquei uma estrela p poder responder a enquete, p mim daria menos 5 estrelas",코멘트가 없습니다. 이전 이메일에서 제 생각을 이미 밝혔습니다. 설문조사에 답변할 수 있도록 별표를 1개만 넣었습니다. 별 5개를 덜 주겠습니다.,
13b7cdafde78bebb404d4dc74c04fb82,,Meu pedido já passou do prazo e o cara da empresa nem responder minhas mensagens não responde.,내 주문이 연체됐는데 회사 직원이 내 메시지에도 응답하지 않습니다.,
6fbe92e0f9d5a728e3fd2be036b5ab05,,Pela segunda vesz que eu compro um produto e voces não cumprem como esta no site.,두 번째로 제품을 구매했는데 귀하가 웹사이트에 명시된 내용을 준수하지 않습니다.,
b9886766c7d03ad40eb4f341af209a88,,Fui enganada comprei gato por lebre detestei não recomendo,"속았어, 콕콕 샀어, 싫었어, 추천하지 않아",
9ae55f703836fe363393a3873c1b42b4,,estou com problemas comprei 2 antenas e só recebi 1 e até agora não tive resposta alguém aí pode me ajudar ,문제가 있습니다. 안테나 2개를 구입했는데 1개만 받았는데 지금까지 응답이 없습니다. 도와주실 수 있나요?,
b67ec1ba150cc097d3ab518272e6cf3f,,ate esta data não recebi o produto ( 07.08.18),현재까지 상품을 받지 못했습니다. (07.08.18),
859baae7fe80b6ffdc2904cc16e16431, voltagem errada,Realizei a compra de um secador na voltagem de 220v. Recebi um na voltagem de 127v.No momento da troca n havia disponível no 220.Por este motivo quero meu dinheiro de volta.,220V 전압의 건조기를 구입했습니다.전압이 127v인 제품을 받았습니다. 교환 당시에는 사용 가능한 220이 없었습니다. 이러한 이유로 나는 돈을 돌려받고 싶습니다.,잘못된 전압
3cb3f6f3260322db164ba9b44b6a07af,,Até o momento não recebi o produto. Aguardando.,현재까지 제품을 받지 못했습니다.대기 중.,
ae9da8a9447f05b1310ecf197fca8bb5,Péssima loja,"Boa tarde. 
O produto acabou de chegar. Contudo só veio 01 unidade e eu comprei 03 unidades. 
Quer dizer que além do produto chegar atrasado, ainda veio com a quantidade errada. Estão faltando 02 un","좋은 오후에요.
제품이 방금 도착했습니다.그런데 01개만 왔고 03개를 구매했습니다.
이는 제품이 늦게 도착했을 뿐만 아니라 잘못된 수량으로 도착했음을 의미합니다.02개 유닛이 누락되었습니다",나쁜 가게
67e09c3ba79d3041e1653c7dbf03425f,,Até hoje não recebi meu produto ,현재까지 제품을 받지 못했습니다.,
03fa3f4dec4b3647d00532079f723fec,,lannister é o pior site de compras na internet muito enrolado as entregas,lannister는 배송이 매우 느린 인터넷 최악의 쇼핑 사이트입니다.,
047d7bce997c4e73c6efe724711fd3b8,,nao recebi meu produto ate agora ,지금까지 제품을 받지 못했습니다.,
922587c6bf637f545a82eb3f9136ae30,,Esperei quase 3 semanas pra receber um adaptador e ele chegar com defeito... Estou muuuito frustrado!!!,어댑터를 받기까지 거의 3주를 기다렸는데 결함이 있는 상태로 도착했습니다... 너무 답답해요!!!,
d809ddde66fee6223df16b11231491f9,,"PRODUTO NAO ENTREGUE, COMPREI DOIS E VEIO SOMENTE UM. ",제품이 배송되지 않았습니다. 2개 구매했는데 1개만 왔습니다.,
7bcd0046dcddeefcc87ed07ba748966b,,Entrega atrasada sera que é correios em greve?,배송이 지연되고 있는데 우체국 파업일까요?,
afde4304cb6e11145784b6ea2126bb33,,"não recomendo, não recebi o produto que comprei mandaram outro produto e ninguém resolve, um lixo de loja, não comprem, um desrespeito com o consumidor eu nunca mais vou comprar nesta loja.",추천하지 않습니다. 구매한 제품을 받지 못했습니다. 다른 제품을 보냈는데 아무도 해결할 수 없습니다. 쓰레기 가게입니다. 구매하지 마세요. 소비자에 대한 무례합니다. 다시는 이 상점에서 구매하지 않습니다.,
eb0786ebf8a32df3392caaf0727e7bbd,,"O produto demorou MUITO para chegar e veio com defeito. Ao contatar a loja, tive que INSISTIR para trocarem mesmo com fotos dos defeitos e ainda por cima tive de pagar para enviar. Prejuízo!","제품이 도착하는데 오랜 시간이 걸렸고 결함이 있었습니다.매장에 연락해보니 불량 사진도 찍어서 교환해 달라고 했고, 게다가 배송비도 제가 부담해야 했어요.편견!",
ea9a48e8b350731ae78378381394a086,,Não comprarei mais mesa loja.,나는 다시는 가게에서 테이블을 사지 않을 것이다.,
bd2b27e7b86e92bf9533282715b8de2a,,"Fiz, em Janeiro, uma compra de um Kit 3 Pendentes Tom Dixon Acabamento em Madeira Branco, com previsão de entrega para 15/02, e hoje é 19/02 e até agora não foi entregue. Quero um posicionamento!!!",1월에 화이트 우드로 마감된 Tom Dixon 펜던트 3개 키트를 구입했습니다. 배송 예정일은 15/02이며 오늘은 19/02이며 지금까지 배송되지 않았습니다.나는 자리를 원한다!!!,
31f2497110f1ac4723c65060cd81dd92,Produto chinês ,"Propaganda enganosa de produto chinês. Não vale 50%do valor cobrado. Não é impermeável, não tem couro na composição.",중국 제품에 대한 허위 광고.청구금액의 50%도 되지 않습니다.방수가 아니며 구성에 가죽이 없습니다.,중국산
4572e35be0f6c21676fce75fcc79162d,,"Não recebi a mercadoria sumil.
Estou no aguardo esperando resposta .","최종상품을 받지 못했습니다.
나는 응답을 기다리고 있습니다.",
c52e91d0960446c0624a5a984188ffba,,Prazo longo e ainda atraso na entrega. Até o momento não recebi o produto e não tenho uma satisfação do que realmente está havendo. Segundo correio o produto ainda não chegou ao destino.,마감 기한이 길고 배송이 여전히 늦습니다.아직까지 제품을 받지 못해서 실제로 무슨 일이 일어나고 있는지 잘 모르겠습니다.게시물에 따르면 제품이 아직 목적지에 도착하지 않았습니다.,
8be6c4274ca6e725ec732002b95ccab5,,O produto veio errado e até agora não tive nenhuma resposta da loja,상품이 잘못 도착해서 현재까지 매장에서 아무런 답변도 받지 못했습니다.,
a7ff25f0e4f6914216004204460f5797,Decepcionada com a compra,"O produto foi entregue com atraso, o pior não foi isso, o mesmo chegou solto em uma caixa suja, tive que usar ""panos"" para limpar a embalagem antes de abrir. A sujeira me deixou indignada!","제품이 늦게 배송되었습니다. 가장 나쁜 점은 더러운 상자에 느슨하게 도착했다는 것입니다. 개봉하기 전에 ""천""을 사용하여 포장을 청소해야 했습니다.먼지가 나를 분개하게 만들었어요!",구매에 실망함
c639d319e7a759b47c407201b57d5522,,Foi pedido 2 itens. So foi entregue 1. Na NF constam os 2.,2개의 상품이 주문되었습니다.1개만 배송되었습니다. NF는 2를 보여줍니다.,
594bad57a253656f86d8282c5365be89,,AINDA NÃO RECEBÍ O PRODUTO !!!,아직 제품을 받지 못했습니다!!!,
3e77cb3c65a1bac64d0516085c2dda55,,"Apesar da credibilidade da empresa lannister, o produto não chegou no prazo estipulado. Continuo aguardando a encomenda.",Lannister 회사의 신뢰성에도 불구하고 제품이 규정된 시간 내에 도착하지 않았습니다.아직 주문을 기다리고 있어요.,
89aaf44e5c7771fbdeacb9baa428988b,,"Não recebi meu produto ainda, de quem é a culpa? Não compro mais nessa loja.",아직 상품을 못받았는데 누구 책임인가요?나는 더 이상 이 가게에서 물건을 사지 않을 것이다.,
09868b0eb512bfbbe98900f16d79d055,,otimo,훌륭한,
18c3c1366ee83a4162a2eefe7bb66f23,,Não recebi e não quero esse produto.,나는 이 제품을 받지 않았으며 원하지 않습니다.,
31c9a3f10eb368b62e102608adbec724,Produto não original ,Produto não informado como paralelo/réplica ,병렬/복제 제품으로 보고되지 않은 제품,정품이 아닌 제품
7c6a400b3bbaff6cff070e8c6cdd17aa,Não recebi o material,"Não posso avaliar por enquanto, o produto foi postado e ocorreu uma greve no Pais. Obrigado.",지금은 평가할 수 없습니다. 제품이 게시되고 국내에서 파업이 발생했습니다.감사해요.,자료를 못받았어요
99239be2fbdb186e7285b71a4bd782ac,,"Apenas nao recebi o produto
Bailarinas","방금 상품을 못받았어요
댄서",
6902f0d9d7309f56f50b8713c3b6a4de,Produto não entregue,O pedido não foi entregue.,주문이 배송되지 않았습니다.,제품이 배송되지 않았습니다
649b01370e30b79f0df619bf8ebc9201,Não Recebi o produto. ,"Não posso avaliar porque NÃO RECEBI O PRODUTO.
GOSTARIA DE SABER PRA QUEM FOI ENTREGUE SE EU MORO SOZINHA?
Aguardo solução para o problema.","제품을 받지 못했기 때문에 평가할 수 없습니다.
혼자 산다면 누구에게 전달되었는지 알고 싶습니다.
문제에 대한 해결책을 기다리고 있습니다.",상품을 받지 못했습니다.
78f48d9a0bb09969516a9fb25e05311e,,"a pulseira é muito dificil de abrir!
",팔찌를 열기가 매우 어렵습니다!,
05fcd933547be81890bc4d62357fdf3f,,O produto veio sem a embalagem,제품이 포장 없이 왔어요,
9f9b0cf9d794e40cdf1c4cf909d65ca4,,"Comprei para presente de Natal dia 27/11, ou seja quase um mês antes, a promessa era dia 22.
Portanto não me restou outra alternativa a não ser comprar outro.
Portanto esse não preciso mais, ","11월 27일에 크리스마스 선물로 샀는데 거의 한 달 전이었는데 약속이 22일이었어요.
그래서 하나 더 살 수밖에 없었습니다.
그러니 더 이상 필요하지 않아요.",
a05955b3170a4c7a3e758f164a61376d,,Não recebi o produto,상품을 받지 못했어요,
100db0fb5000a9f02f0d3ee2470c85c1,,entao segundo produto que atrasa pra chegar esse ia chegar 5/04 ainda nada de chegar,그래서 오늘 늦게 도착하는 두 번째 상품이 5월 4일에 도착했는데 아직 아무것도 도착하지 않았습니다,
f83a57cc6e5cab20740d40eaa72dff00,,Paguei por um produto e veio outro (tamanho errado ) valor inferior ao que paguei! !,한 제품에 대한 비용을 지불했는데 내가 지불한 가격보다 적은 가격으로 다른 제품이 도착했습니다(잘못된 사이즈)!!,
64397bf4c493c0fa84f413977e87da93,,"muita demora na entrega, produtos comprados com os demais chegaram à muito tempo.","배송지연이 길어서, 다른 사람과 함께 구매한 제품이 오래전에 도착했어요.",
5a349f273f2b09f31ea9e761ae655586,,"Consumidor lesado, inadmissível uma empresa deste porte comercializar produtos piratas em sua página oficial. Relógio réplica da mais barata. Tomarei medidas cabíveis.","피해를 입은 소비자, 이 정도 규모의 회사가 공식 페이지에서 불법 복제 제품을 판매하는 것은 용납될 수 없습니다.가장 저렴한 복제 시계.적절한 조치를 취하겠습니다.",
8273d2fc0ec9b9e27e2f3998daebb8ed,,Isso chegou quebrado,이거 깨져서 도착했어요,
075a544c5f4ed4bb75f82b160465fe76,,"Estou aguardando a encomenda. 
Recebi o aviso de dificuldade na entrega, mas ninguém entrou em contato para dizer o q realmente aconteceu. ","주문을 기다리고 있어요.
배송에 어려움이 있다는 통지를 받았지만 실제로 무슨 일이 일어났는지 알려주는 사람은 아무도 없었습니다.",
f79bd0b3bacc5142f90f81a15b4a602c,,"Comprei um caminhão brutus vermelho de presente para meu filho e recebi uma escova de dentes. Quero que esta situação se resolva o mais rápido possível, pois o aniversário do meu menino já foi e a fru",아들 선물로 빨간색 브루터스 트럭을 사서 칫솔을 받았습니다.우리 아들의 생일도 이미 지났고 과일도 많이 먹었으니 이 상황이 하루빨리 해결되었으면 좋겠습니다.,
eb9467fb82e562d5d44ece6d6b8a42d0,,Ainda não recebi o produto ,아직 제품을 받지 못했어요,
c2a550cc5f966506b717532441c221e5,,Não recebi meu produto ,제품을 받지 못했습니다,
f7203d9ccdf6519081031222d1f49788,,O produto não foi entregue conforme o prazo e não consigo receber meu dinheiro de volta pela lannister.,제품이 예정대로 배송되지 않아 Lannister로부터 환불을 받을 수 없습니다.,
b13b0fdb62f3213d2d55a93da49c72a4,,Até a presente data o produto não foi entregue.,현재까지 해당 상품은 배송되지 않았습니다.,
9ff880794dc0a00ad4856e0de2c912f2,Produto não entregue ,"Não recebi o produto e não tive nenhuma satisfação da empresa e no status consta como entregue, sempre comprei pela sub e nuca nunca tive esse tipo de problema, MUITO INSATISFEITA, quero meu dinheiro ",제품을 받지 못했고 회사로부터 어떤 만족도도 없었으며 상태에는 배송됨이라고 표시되어 있습니다. 저는 항상 서브를 통해 구매했고 이런 유형의 문제는 겪어본 적이 없습니다. 매우 불만족스럽습니다. 돈을 원합니다,제품이 배송되지 않았습니다
b9ec9404685b3beb2a2eb3d2c57ce666,PRODUTO COM DEFEITO,"Cartão Micro SDClasse10Com Adap64GB Sandisk , rec. dif. do anunciado não funciona parece prod. paralelo reportei no site das lannister o ocorrido em 17/05/18 até o momento não tive nenhum retorno","마이크로 SD 카드Classe10Com Adap64GB Sandisk, Rec.차이 광고대로 작동하지 않는 제품인 것 같습니다.동시에 Lannister 웹사이트에 2018년 5월 17일에 일어난 일을 보고했습니다. 지금까지 어떤 응답도 받지 못했습니다.",결함이 있는 제품
0ce9a24111d850192a933fcaab6fbad3,,Não gostei ! Comprei gato por lebre,나는 그것을 좋아하지 않았다!I bought a pig in a poke,
4035b52134bcb1bdaf305b4671495372,,Não gostei tecido ruim péssimo ,마음에 들지 않았습니다. 천이 나쁘고 끔찍했습니다.,
96d307dc05503506515055b86a580e86,,"Passou do prazo de entrega, demorou.","배송일이 지났고, 시간이 오래 걸렸습니다.",
e29802498c81638fb4377d7c7137031e,,Comprei dois telescópios e só foi entregue 1.,망원경 2개를 구입했는데 1개만 배송되었습니다.,
378f58a3d4b989b3517b56488dc4e3cf,,"Veio faltando um cartucho, só me enviaram 1",카트리지 1개가 누락되어 1개만 보냈습니다.,
a35238675f91b99761c23af5c842d5ef,,"Peço providências urgentes, pois o produto consta nos Correios como entregue, no entanto eu NUNCA efetuei a retirada do mesmo. Continuo no aguardo de v.sas. Espero não ter que procurar meus direitos.",제품이 우체국에 배달된 것으로 나타나므로 긴급 조치를 요청합니다. 그러나 저는 제품을 수령한 적이 없습니다.나는 아직도 당신을 기다리고 있습니다.내 권리를 찾을 필요가 없기를 바랍니다.,
b560ced1765e243b3ebf765d80a8873d,não recomendo,"comprei uma cortina de 3x2,80. me enviaram duas cortinas, sendo cada uma de 1,50x2,80. PALHAÇADAAAAAAAAAAAAAAAAAAAAAAAAA.


se eu quisesse uma cortina de 1,50 eu comprava de 1x50, e não de 3 metros","3x2.80 커튼을 샀어요.그들은 나에게 각각 1.50x2.80 크기의 커튼 두 개를 보냈습니다.광대아아아아아아아아아아아아아아아아.


1.50미터 커튼을 원했다면 3미터가 아닌 1x50을 구입하겠습니다.",나는 추천하지 않는다
c09eea5faf2f865d54fac5b97b961a75,,Nao compro mais na lannister. Se é parceiro da lannister ou não essa targaryen jamais uso novamente. Quando eu ler que é dessa empresa saio correndo. Um absurdo. Quase um mês para entregar. Extra.com ok,"저는 더 이상 라니스터에서 제품을 구매하지 않습니다.당신이 라니스터 파트너이건 아니건, 나는 이 타르가르옌을 다시는 사용하지 않을 것입니다.이 회사에서 온 것이라는 말을 듣고 도망갈 거예요.터무니없는.배송까지 거의 한달.Extra.com 좋아요",
1a358c4ef8c7d066e7e526670d486f3e,,quanto tempo mais de espera?,얼마나 더 기다려야 하나요?,
2d1532a0e5de7237f34903019cf8f3d3,,Comprei 50 bolinhas de plástico e vieram só 42.,플라스틱 공 50개 샀는데 42개만 왔어요.,
d89d67960e5c163e8afc1d83cf53db77,,Chateada com a demora! Sempre compro da lannister e isso nunca tinha acontecido ,늦어서 속상해요!나는 항상 Lannister에서 구매하는데 이전에는 이런 일이 발생하지 않았습니다.,
15cc05afae8fa894c83b39ac8d46c9d5,,Duas caixas vieram um pouco deformadas (uma caixa dentro da outra) não encaixando as tampas..como houve demora na entrega optei por não efetuar a troca pelo transtorno do processo e mais demora.,"두 개의 상자가 약간 변형되어 도착했고(한 상자가 다른 상자 안에 있음) 뚜껑이 맞지 않았습니다. 배송지연이 발생하여, 배송지연이 길어지는 과정의 불편함을 이유로 교환을 하지 않기로 결정했습니다.",
707a334be449a3283d0312d4290d8077,Ruim,Comprei o produto capa de máquina lavar e secar Samsung 10.1kg e recebi o produto modelo Samsumg referente à 7.5 kg.,"삼성 10.1kg 세탁기, 건조기 커버 제품을 구매했고 무게가 7.5kg인 삼성 모델 제품을 받았습니다.",나쁜
6ac28bc08c8053bb1c00241b19daea2b,,Ainda não recebi o produto,아직 제품을 받지 못했어요,
b9a089706e16d5490f7a2feb363e32e9,,Esperava mais do produto. Muito duro o puxador da mala e a lancheira veio vazia. Esperava ao menos um squeezi e um potinho. Não valeu a pena pelo preço. Produto deixou a desejar. ,나는 제품에서 더 많은 것을 기대했습니다.여행가방 손잡이가 너무 딱딱해서 도시락이 텅 비어 도착했어요.나는 적어도 스퀴지와 냄비를 바랐습니다.가격대비 아깝지 않았어요.제품에 아쉬운 점이 있었습니다.,
ec99cf3ef9a84993f1e55aa4fc615c42,Esperando,"Estou aguardando a dupla de quadros, pois so foram entregues as cortinas!! Apos receber, altero minha avaliação!!!",커튼만 배송되어서 그림 한쌍 기다리고 있어요!!받고 나서 리뷰를 바꾸겠습니다!!!,대기 중
efeaeef213e3c173e91d9ffe670ba677,,Meu produto não foi entregue.,내 제품이 배송되지 않았습니다.,
a85de20f557d7c93da92888cde9b7aef,,Eu ainda não recebi o produto,아직 제품을 받지 못했어요,
88d29e2e31284a2d643ca7a77458675d,,Produto veio com defeito é não consigo e não consigo contados com nada para me ajudar a entrar em contato para efetuar a troca,제품에 결함이 있는 도착했는데 교환을 위해 연락할 수 없고 믿을 수 없습니다,
9f5bd892aa4c461b116e5c163f16b40a,,"Se a loja não tem a responsabilidade de entregar os produtos por que continua no site da baratheon,pois já liguei várias vezes na baratheon q disse q eles entrariam em contato ",매장에서 제품 배송에 대한 책임이 없는데 왜 아직 Baratheon 웹사이트에 나와 있나요? Baratheon에 여러 번 전화했더니 연락하겠다고 하더군요.,
d5126e0c4988c70a3808041792214dcc,,"Espero que chegue o produto estou aguardando , ainda não chegou.",상품이 도착하길 바라며 기다리고 있는데 아직 도착하지 않았습니다.,
30f610db02d0880c9687dd1edd8b8710,Envio incompleto,"Comprei o produto me mandaram fora da embalagem original, dentro de a caixa avulsa tudo solto, não me mandaram a nota fiscal, nem o manual,",제품을 구입했는데 원래 포장도 없고 별도의 상자 안에 들어 있고 모든 것이 헐거웠으며 송장이나 설명서도 보내지 않았습니다.,불완전한 제출
0db053a048333680c09114ac4f231a79,,"Produto fora do prazo, ainda não foi entregue
",제품이 오래되어 아직 배송되지 않았습니다.,
98974b076b01553d49ee6467905675a7,,O prazo de entrega muito maior que concorrentes - mais de TRINTA DIAS,경쟁사보다 훨씬 긴 배송 시간 - 30일 이상,
fa501c06e7a60e98b43e678fd5205c37,Produto de qualidade ruim,Produto diferente do que foi anunciado.,광고된 내용과 다른 제품입니다.,품질이 나쁜 제품
608423eb49f078b0c2095dbdbe03c210,Não recomendo,O produto chegou sem problemas. Mas ele não é o que esta sendo dito. Sua tabela nutricional é enganosa e o produto adulterado! Não é whey protein isolado!,제품은 문제없이 도착했습니다.그러나 그것은 말하고 있는 것이 아니다.귀하의 영양표는 오해의 소지가 있으며 제품에는 불순물이 포함되어 있습니다!분리유청단백질이 아닙니다!,나는 추천하지 않는다
c1459f8c6638b835a54df0c0246ce486,,"Após a espera de mais de um mês de espera, a data informada de entrega não foi cumprida.",한 달 넘게 기다려도 공지된 배송일을 맞추지 못했습니다.,
0d1125edf803ac46b5804fc0d29730c3,,"Ótima loija produto entregue dentro do prazo,Produto muito bom","정시에 배송되는 훌륭한 매장 제품, 매우 좋은 제품",
9f0b93157ce9331253cad4298ce6af61,Quadro quebrado,"Infelizmente o meu quadro veio com a moldura quebrada, danificando a tela. Deu trabalho para concertar ",불행하게도 제 그림은 액자가 깨져 캔버스가 손상되어 도착했습니다.고치는 데 노력이 필요했어요,깨진 프레임
11a6156f787eb963fb211db50db44d99,Não recebi ,Ainda estou aguardando ,난 아직 기다리고 있어요,나는받지 못했다
a6a81ef0cba0e11e230b4d19a6e8c559,Ainda NAO recebi o produt,O Produto não chegou.,제품이 도착하지 않았습니다.,아직 제품을 받지 못했어요
15c371c7aa7f65f363f03818e30090ad,,"A realização da compra foi realizada com um prazo de entrega longo de 20 dias e a previsão de ATÉ 26/12, fato não ocorrido. O produto ainda não foi entregue! Não respeitaram o prazo. NÃO INDICO!!",구매는 20일의 긴 배송 기간으로 이루어졌으며 12/26까지 예상되었지만 발생하지 않았습니다.상품이 아직 배송되지 않았습니다!그들은 마감일을 존중하지 않았습니다.나는 추천하지 않는다!!,
d51efba225d758550821c63b23bcf48b,o produto não funciona,o produto não funciona e não consigo falar na loja no site.preciso que me ajudem a trocar o produto.,제품이 작동하지 않고 홈페이지에서 매장과 통화가 되지 않습니다. 제품 교환을 도와주셔야 합니다.,제품이 작동하지 않아요
e9b6e40d2bb6586f7be9c87170ceaacf,,Nao recebei o produto até agora.,지금까지 제품을 받지 못했습니다.,
87fc097f0342e12e5eeb4e772b40a96a,,"Bom dia.
Comprei uma capa para Lancha de 21 a 23 Pes, e apos longo prazo de entrega, recebi o produto errado, uma Capa de Capo p/ Motor de Popa da Yamaha.","좋은 아침이에요.
21~23 Peer Boat용 커버를 구매했는데, 오랜 배송 시간 끝에 잘못된 제품인 Yamaha 선외기 모터 후드 커버를 받았습니다.",
f5c7fcc9933ae8861462ee79735d9993,,"Pedido prometido para 22/12, ainda não recebido.",12/22일로 약속된 주문이 아직 접수되지 않았습니다.,
4a3798db024e5f7ec925bd803ec5567c,vou devolver o produto,O produto não é como pensei que fosse. ,제가 생각했던 제품이 아니네요.,상품을 반품하겠습니다
21ab5b80c7c152432a699cde9af9a04c,,"Como ja informei fiz a solicitação de apenas 1 produto me enviaram 2 estou solicitando o cancelamento e ninguém me retorna, estou de cara com o desinteresse das lannister .com com o cliente . ",이미 알려드린 대로 제품 1개만 요청했는데 2개를 보냈습니다. 취소를 요청했는데 아무도 답장을 보내지 않아 고객에 대한 lannister.com 측의 관심이 부족한 상황에 직면했습니다.,
03caa2c082116e1d31e67e9ae3700499,,"Peço por favor verificar a entrega do pedido, pois não recebemos.",주문하신 상품이 아직 접수되지 않았으니 배송상태를 확인해주세요.,
211635839640ec89714ed4410c5d9eea,"Péssimo, não recomendo","Comprei um carregador para Iphone preto, e veio o carregador na cor branca, diferente do que pedi, e demora muito para carregar o celular. ","검정색 아이폰 충전기를 구매했는데, 충전기가 주문한 것과 다르게 흰색으로 왔고, 휴대폰 충전에도 시간이 오래 걸립니다.",끔찍해요 추천하지 않아요
dd45d98300be58b78e0294efbe19d1d0,,Demora a entrega,배송지연,
53f4a393eb9126386cfc207f1aa6ac34,,"O PRODUTO QUE ME FOI ENVIADO, NAO CONFERE COM O QUE EU PEDI.",나에게 보낸 제품이 내가 주문한 제품과 일치하지 않습니다.,
5f673b3f9980fdd744937e959c80dcbd,,Quando vou receber? O prazo acho que e ate dia 14/04,언제 받을 수 있나요?마감일은 4월 14일인 것 같아요.,
713638fce61820946eea7e0773d1df84,,"Eu ainda não recebi o produto, gostaria de saber o que aconteceu?? ",아직 상품을 받지 못했는데 무슨 일이 일어났는지 알고 싶습니다??,
866aba819ecb20582614f90f9889da26,,DEMORA DIMAIS NA ENTREGA PEDIDO AVALIAÇÃO E O PRODUTO AINDA NEM CHEGOU ,평가를 위한 배송 지연 요청이 있으며 제품이 아직 도착하지 않았습니다.,
695eed4f6656d10f32a49760523169de,,no site dizia que chegaria até 13/03 e ainda não chegou!,웹사이트에는 3월 13일까지 도착한다고 되어 있는데 아직 도착하지 않았습니다!,
