order_id,review_comment_title,review_comment_message,message_ko,title_ko
e8f1e6bc58ce50eb224d5ea7408a88c0,"demoro, esta aida na estr","demora, paguei um absurdo no frete ainda não chego, eu reclamei para correio para a lojas amiricanas, o correio falo q não pode faser bada q eu tenho q esperar, ja passo do prazo de entrega","시간이 오래 걸려요, 배송비가 터무니없이 많이 냈는데 아직도 안 와요, 미국 매장은 우체국에 항의했는데, 우체국에서는 안 된다고 해서 기다려야 해요, 벌써 배송 기한이 지났어요","늦었어, 아직 가는 길이야"
bf970de78f9812577f8bc51197b05942,,"O piano veio com o botão de volume quebrado e desde o dia 27/01 estou tentando trocar o piano e não consigo, nunca mais compro no stark e nem dessa targaryen",피아노는 볼륨 손잡이가 파손된 상태로 도착했고 1월 27일부터 피아노를 바꾸려고 노력했지만 변경할 수 없습니다. 다시는 Stark나 이 Targaryen에서 구매하지 않을 것입니다.,
6f95997d009a6c89f18029f779a6de56,,Não recebi o produto ,상품을 받지 못했어요,
bf1972c220f071324a3032cb351479b2,,Produto entregue com avaria e não tem estoque para repor,배송된 제품이 파손되어 교환할 재고가 없습니다.,
1d496c62bf852e069018c2b038064949,,Preciso de uma posição pois não recebi o mesmo.,같은 자리를 받지 못했기 때문에 자리가 필요합니다.,
90ae645ceacd8832133a491224beb6b1,,"Bom dia! Até a presente data não recebi o meu produto e ninguém ainda entrou em contato para dar satisfação.
Quem vai dar retorno??","좋은 아침이에요!현재까지 나는 내 제품을 받지 못했고 만족을 위해 나에게 연락한 사람도 아직 없습니다.
피드백은 누가 주나요??",
eef06779a3b6d4c50bb9dd92796a9782,,Produto de Péssima qualidade!,품질이 좋지 않은 제품!,
77670d903936f910039e218bb3ea400d,,O descrição do do produto no site .sobre o tamanho não confere com produto recebido....muito pequena .....,홈페이지에 있는 제품 설명입니다. 크기가 받은 제품과 일치하지 않습니다....매우 작습니다.....,
ae6ef9d73ed303060dc1a61a9ab01424,Péssimo ,"Meu produto está errado. A nota fiscal e prodito está na nome de outra pessoa. 
Eu não estou conseguindo entrar em contato pra pedir o meu produto certo","내 제품이 잘못되었습니다.송장과 상품이 타인의 명의로 되어 있습니다.
올바른 제품을 주문하기 위해 연락할 수 없습니다.",끔찍한
430bd310105f069ac72ef7758f40299b,A câmera não funcionou,Câmera não funcionou ,카메라가 작동하지 않았습니다,카메라가 작동하지 않았어요
8375044308874af1c50719ecaee3786d,,"Ainda nao recebi meu produto, que seria entregue ate dia 12 de janeiro de 2018
",2018년 1월 12일까지 배송될 제품을 아직 받지 못했습니다.,
88498659c4bfb68808d6b49a57a6ed17,,O produto adquirido não foi entregue; Já se passaram 5 dias da previsão de entrega dada pelo fornecedor.,구매한 상품이 배송되지 않았습니다.공급업체가 제공한 예상 배송일로부터 5일이 지났습니다.,
72fb560d115ecf3b15de9b853c02e505,Não recebi o produto.,Não tenho como avaliar um produto que não recebi.,제가 받지 못한 제품은 평가할 수 없습니다.,상품을 받지 못했습니다.
a7d88dd59dbc3b0239f9284e1d72ff84,,"Ainda não recebi o produto e gostaria de ter uma posição, isso é uma falta de respeito com o consumidor, não dão nenhuma satisfação já entrei em contato 3 vezes e até agora nada l. ",아직 제품을 받지 못했는데 답변을 듣고 싶습니다. 이는 소비자에 대한 존중이 부족하고 만족스럽지 못합니다. 이미 3번이나 연락했지만 지금까지 아무것도 없습니다.,
09c636e254bb18eeef943452017249f4,,"Produto com defeito 
Preciso trocar
","제품 불량 
나는 변해야 해",
ac9c24587cf6cf6fc0276576b9e95cc6,,ainda nao recebi o produto... e agora como faço para reter meu dinheiro? ,아직 제품을 받지 못했습니다. 이제 돈을 어떻게 보관할 수 있나요?,
473827dcccc5dc6888a85e17f4965ed4,Produto errado ,"O produto que comprei era um tapete higiênico de cão com 90x100 por motivo do meu cachorro ser de grande porte e foi entregue 2 de 50x60 .
A nota fiscal emitida deixa bem claro que está errado.","제가 구매한 제품은 저희 강아지가 대형견이라 90x100 애견변기매트인데 50x60 2개가 배송되었습니다.
발행된 청구서는 그것이 잘못되었음을 매우 분명하게 보여줍니다.",잘못된 제품
1a9543c90f188e2e4fb14327ad4a9c9b,,"- a compra foi efetuada em 30/01
- a emissão da nota fiscal emitida em 05/02
- até 16/03 ainda não recebemos a mercadoria
- que avaliação deveríamos dar a isto?
- desonestos? ineficientes? etc, et","- 구매일은 01/30 입니다.
- 2005년 5월 발행된 청구서 발행
- 3월 16일 현재 아직 상품이 도착하지 않았습니다.
- 이에 대해 어떤 평가를 내려야 할까?
- 부정직한가?무능한?등등, 등등",
cb1fa6d103d46946a84deca659f7385b,,"Fiz a compra de duas unidades.
Recebi apenas um, e na nota fiscal constam 02 itens.","나는 두 대를 구입했습니다.
하나만 받았는데 송장에는 2개의 항목이 포함되어 있습니다.",
3a213fcdfe7d98be74ea0dc05a8b31ae,,"bom dia ainda não recebi toa a minha encomenda, pos fiz o pedido de 12 relógios de parede ate agora so chgaram 6",좋은 아침입니다. 아직 주문을 받지 못했습니다. 지금까지 벽시계를 12개 주문했는데 6개만 도착했습니다.,
179643231d5131dc81e54ce16437972f,,"Meu produto não foi entregue, sem me da nenhuma informação. Cancelaram meu pedido sem me informar de nada.Nao gostei",어떤 정보도 제공하지 않은 채 내 제품이 배송되지 않았습니다.그들은 나에게 아무 것도 알리지 않고 내 주문을 취소했습니다. 나는 그것을 좋아하지 않았다,
fae47c33ced01bcd86b7152ca8c6d803,,"Vende um produto na foto vermelho e manda outro, que por sinal veio de outra marca e na cor verde, totalmente fora do que anuncia no site... nunca mais compra nesta loja.",그들은 빨간색 사진의 제품을 판매하고 다른 브랜드에서 온 다른 제품을 보내고 녹색으로 웹 사이트에 광고된 것과 완전히 다릅니다... 다시는 이 상점에서 구매하지 마십시오.,
68bb4de546513f8cdd2c1d21fc3bc114,,Pedi um produto e recebi outro! ,한 제품을 주문했는데 다른 제품이 도착했어요!,
ce4c50f30197a0330b034d27da7f5ed6,,"A resistência deveria vir uma 110 e outra 220.
Vieram duas 110.
Essa foi a razão de meu desapontamento.
E como corrigir?","저항은 110과 220이어야 합니다.
110 2개가 왔습니다.
그것이 제가 실망한 이유였습니다.
그리고 그것을 고치는 방법은 무엇입니까?",
de1f63780a06d4800d094e9875c89ac5,,"Quero receber o que eu comprei, gostaria de um retorno de quando irei receber",구매한 상품을 받고 싶습니다. 수령 시기에 반품하고 싶습니다.,
c66c3d7b42dbd139f921139df1eeb31c,,Veio número errado veio cor errada nao recomendo gostaria de compra mais nao confio no vendedor,잘못된 번호가 잘못된 색상으로 왔습니다. 추천하지 않습니다. 구매하고 싶지만 판매자를 신뢰하지 않습니다.,
6f30b59ca40f5851d931d146ef6868d0,Produto incompleto,Faltou a grama,잔디가 없어졌어요,불완전한 제품
64c8d713a96944349d954eb4bd62e6d5,,O produto veio com defeito,제품이 불량으로 도착했어요,
8e65dc9111065511a3429687624b4fd2,,produto veio faltando acessórios e ate agora não recebi ,제품에 부속품이 누락되어 왔는데 아직 받지 못했습니다.,
61d5f1dcdf9b023ea7622b65d2362e4f,,"Aguardo a devolução do produto pois o mesmo veio sem caixa,e riscado.",제품이 박스도 없이 도착하고 긁힌 부분이 있어서 반품을 기다리고 있습니다.,
47a59571eaf621fe16f74c18e25fa329,,"Não recebi o produto, não sei se o problema é da loja ou dos Correios, se for dos correios, entendo que a loja deveria arrumar outra forma de envio, já que não podemos mais confiar nos correios.",제품을 받지 못했습니다. 문제가 매장에 있는지 우체국에 있는지 모르겠습니다. 우체국에 문제가 있는 경우 더 이상 우체국을 신뢰할 수 없기 때문에 매장에서 다른 배송 방법을 찾아야 한다는 점을 이해합니다.,
92f21edc7e69a84e3e521e9adc7c83b8,Produto faltando,"Boa tarde !
Comprei tres produtos so chegou dois, por isso nao tem como eu responder que meu produto chegou. Por favor resolvam isso.","좋은 오후에요 !
3개 구매했는데 2개만 도착해서 상품이 도착했다고 답변드릴 방법이 없네요.이 문제를 해결해 주세요.",누락된 제품
ee972a8714e62c729101427fc247d37e,,"Material do produto não vale pelo valor do próprio, material muito fraco, a loja não específica o material se tela ou não.",제품 소재는 그 가치가 없으며 소재가 매우 약합니다. 매장에서는 소재가 캔버스인지 여부를 지정하지 않습니다.,
0f7bc9011b887a3d145db483b0d8c25f,,"Trinta dias pra receber um produto e ainda não chegaram todos 
E vcs deram 17 dias
Falta de compromisso ","제품을 받기까지 30일이 걸렸지만 아직 제품이 모두 도착하지 않았습니다. 
그리고 넌 17일을 줬어
헌신의 부족",
7659a1c749ab19031d8e957692aa114d,Quero devolver meu produt,Veio faltando não era o que eu queria quero devolver,"없어졌어요, 제가 원하는게 아니었어요, 반품하고 싶어요",제품을 반품하고 싶어요
59a7ff272ffc5a0a705f006f9b2db1b9,,Não recebi o produto que comprei. Comprei um gravador espiao Rc609 e não me entregaram o produto certo. Recebi um gravador de voz digital S006 novacom. Gostaria de deixar a minha reclamação. ,구매한 상품을 받지 못했습니다.Rc609 스파이 녹음기를 구입했는데 올바른 제품이 나에게 전달되지 않았습니다.나는 novacom S006 디지털 음성 녹음기를 받았습니다.불만사항을 남기고 싶습니다.,
1f4010e63b5ac13defa48305766a912a,,"Após a compra no site, fiz a solicitacao do cancelamento da msm e nao fui atendido. Tentei várias vezes entrar em contato e nao consegui. Agora que o produto chegou quero devolve lo.",홈페이지에서 구매 후 MSM 취소를 요청했는데 답변이 없습니다.몇 번이나 연락을 시도했지만 연락이 닿지 않았습니다.이제 상품이 도착했으니 반품하고 싶어요.,
35c3b3b2f196293240304eb8601b3d8c,,Produto nunca chegou a mim já com tanto tempo . ,오랫동안 제품이 나에게 도착하지 않았습니다.,
18c643cade587cd125b3a56377985cac,,"NÃO RECEBI O PRODUTO, O PRODUTO CONSTA COMO ENVIADO PARA O CORREIO DE RIBEIRÃO PRETO. O CORREIO NÃO RECEBEU O PRODUTO. ENVIE VARIAS MENSAGEM PARA A targaryen E NÃO OBTIVE. ESTA targaryen ESTA SUJANDO SEU NOME",제품을 받지 못했습니다. 제품이 CORREIO DE RIBEIRÃO PRETO로 전송된 것으로 표시됩니다.택배기사가 제품을 받지 못했습니다.나는 Targaryen에게 여러 메시지를 보냈지만 받지 못했습니다.이 타르가르옌이 당신의 이름을 망치고 있습니다,
d4eff8d7652db5a92efaf867550013ca,,"A única coisa q eu não venho gostando em comprar no site de vcs é que algumas das mercadorias q comprei, tive q ir buscar no correio, não chegou até a minha casa, sendo que pago frete.",귀하의 웹사이트에서 구매하는 것이 마음에 들지 않는 유일한 점은 제가 구매한 일부 상품을 우체국에 가서 가져와야 했는데 집에 도착하지 않았고 배송비를 지불해야 한다는 것입니다.,
aff8085aa67afd7180c91552d939a4dd,,Comprei dois pneus ( dianteiro e traseiro ) mas so recebi o traseiro.,"타이어 2개(앞, 뒤)를 구입했는데 뒤 타이어만 받았습니다.",
9af6f205c7247ac28685a350094ce865,,Ainda não recebi o produto sendo que a compra foi feita em com antecedencia,미리 구매해서 아직 상품을 받지 못했어요,
2f722ee8f3d3db0d19cee8ebea6fa69e,,"Enviaram as colchas separadas, tive q abrir reclamaçao porque chegou 1 nota fiscal c o valor das 2,contudo só chegou 1.Depois de 2 dias entregaram a segunda, ou seja, não faz sentido.","허벅지를 따로 보냈는데 2개 금액의 송장 1개가 도착했는데 1개만 도착해서 항의를 해야 했습니다. 이틀 후에 그들은 두 번째를 배달했습니다. 즉, 말이되지 않습니다.",
1a36898abaa63533a009c410d9947357,NAO GOSTEI,"PERCEBI UM ERRO APÓS FECHAR A COMPRA. IMPOSSIVEL CANCELAR, MESMO ANTES DE EMITIR NF. NÃO RESPONDEM EMAIL, CONTATO TELEFONICO NAO FUNCIONA. PÉSSIMA EXPERIENCIA",구매를 종료한 후 오류를 발견했습니다.NF 발행 전이라도 취소가 불가능합니다.그들은 이메일에 응답하지 않으며 전화 연락이 작동하지 않습니다.끔찍한 경험,나는 그것을 좋아하지 않았다
bbcde37a6b3008557c47e31e37523380,,"meu pedido veio errado, veio outro produto.",주문이 잘못되어 다른 상품이 도착했습니다.,
c8e51524cf9ae78ec9f421b1054378ff,,"O produto não aparece o mesmo da foto , veio MOLHADO e com o cheiro muito forte . Não compraria novamente e muito menos indicaria ","제품은 사진과 동일하지 않습니다. 젖은 상태로 도착했으며 매우 강한 냄새가 났습니다.나는 그것을 다시 사지 않을 것이고, 훨씬 더 추천하지 않을 것입니다",
f24bbebc2c8ba687b65f1be751dd8982,,Não recebi o produto no prazo previsto ,예상 기간 내에 제품을 받지 못했습니다.,
6e5fc24bede0e47389f2042dc5f8473f,pRODUTO SIMPLES,"NÃO SEI SE CRIEI MUITAS EXPECTATIVAS, MAS ACHEI O PRODUTO SIMPLES.","제가 많은 기대를 했는지는 모르겠지만, 제품이 단순하다고 생각합니다.",간단한 제품
9792283e8d46d73ee4a3d91fc3264a50,,O produto consta como entregue mas nao recebi,상품이 배송완료로 표시되는데 상품을 받지 못했습니다,
bfbf45695ada6f6c2b2bbf14d224aeb1,,"A LOJA ME ENTREGOU UM RELÓGIO COM DEFEITO. ATRASA QUATRO HORAS, ISSO QUANDO NÃO PÁRA. DETALHE: O PROBLEMA NÃO É A BATERIA. QUERO MEU DINHEIRO DE VOLTA. ATÉ AGORA SÓ ME ENVIARAM E-MAILS. SOLUÇÃO NAD",매장에서 나에게 결함이 있는 시계를 선물했습니다.4시간 동안 지연이 발생해도 멈추지 않습니다.세부사항: 문제는 배터리가 아닙니다.돈을 돌려받고 싶어요.지금까지 그들은 나에게 이메일만 보냈습니다.NAD 솔루션,
f53340ca014b3ee6d71eaca8c0262828,,Não recebi os dois controles. O que houve?!? ,두 컨트롤을 모두 받지 못했습니다.뭐가 있었어?!?,
4de5beb49e4389e91971200bacf4e024,,olha as toalhas nao sao o que eu esperava achei muito abaixo da qualidade que eu esperava,"보세요, 수건은 제가 기대했던 것과 다릅니다. 품질이 제가 기대했던 것보다 훨씬 낮았습니다.",
cb5a90448282b7b65850b10544dbb22a,," Infelizmente recebi a cadeira no período correto mas veio faltando uma peça , já envie e-mail para a loja e até o momento não recebi a resposta. ( já se passaram 24h). ",안타깝게도 정확한 시간에 의자를 받았는데 한 조각이 누락되었습니다. 매장에 이메일을 보냈는데 지금까지 답변을 받지 못했습니다.(24시간이 지났습니다.),
291db83cebe0c7179310b62e0a7e2714,produto não chegou,ainda não recebi a encomenda até agora!,아직 주문을 받지 못했습니다!,제품이 도착하지 않았습니다
1b506ab4d2fae3d70d95f8d0a4d8d094,,Estou aguardando meu produto.,나는 내 제품을 기다리고 있습니다.,
5f8f11858f0aa38dd3dac7d851aced95,,o produto estava previsto para chegar dia 10/11 até hj ainda n recebi nada... estou precisando urgente!!,상품이 10/11 도착 예정이었는데 오늘까지 아무것도 못받았어요... 급하게 필요해요!!,
70a3acb4b096f675be6a2e03e2fb67bd,Me enganaram... ,"Comprei o tapete com a metragem 2,50 x2,50 e me mandaram a metragem 2,0 x 2,50, sendo que no siteo valor dessa metragem que me enviaram está bem abaixo do valor que paguei... ",2.50 x 2.50 크기의 카펫을 구입했는데 2.0 x 2.50 크기를 보냈는데 웹사이트에서 보낸 크기 값이 내가 지불한 값보다 훨씬 낮습니다...,그들은 나를 속였습니다 ...
7b072cb297a1526bf0dcd28d61c6004d,,"Atraso em cima de atras, nenhuma informação sobre eles e nenhuma retratação: total falta de comprometimento com clientes.","지연에 대한 지연, 이에 대한 정보 없음 및 철회 없음: 고객에 대한 헌신이 완전히 부족합니다.",
f9c47932f5342ee9c86d3492bc4e50f5,,"Até agora não recebi o produto que foi comprado para dar e Natal Natal minha filha, quando ligo ninguém sabe me dar uma posição e fqyei no prejuízo.","딸에게 크리스마스 선물로 산 제품을 지금까지 받지 못했는데, 전화를 하면 자리를 어떻게 알려줄지 아무도 몰라 헤매고 말았습니다.",
2567acdbfc6fa8d47fce09510677b955,,Até o momento não recebi o produto,현재까지 제품을 받지 못했어요,
6f8f0e3ba6fb99d979b8db8728b6a385,,nao recebi o produto acredito ser problema dos correios prazo de entrega expirou,제품을 받지 못했습니다. 우체국 문제인 것 같습니다. 배송 시간이 만료되었습니다.,
2b669d60912d3d0f9ab639002e8883f0,,Nao recebi as duas colchas estou sem a colcha fantasy,두 퀼트를 모두 받지 못했습니다. 판타지 퀼트가 없습니다.,
2446a642fca6873ebfd22332c6657732,COMPREI 3 INTEM,"So foi 2 intem luva e toca. Falta colete tático e não tem código pra acompanha o intem, so informa que produto foi entregue.","구성품은 장갑과 모자 딱 2개뿐이었습니다.전술조끼도 없고, 상품에 동봉되는 코드도 없고, 어떤 상품이 배송됐는지 알려줄 뿐입니다.",나는 3개의 INTEM을 구매합니다
98d7e0d168a393093a391519c1ee1e8e,,não foi entregue,배달되지 않았습니다,
f73d73f08d9e97a496861a69bf371880,,"Os garfos e facas adquiridos demoraram muito para chegarem e vieram sem a NF, jogados numa caixa deformada e os utensílios todos de baixa qualidade, vieram amassados e com as pontas dos garfos tortas.",구입한 포크와 나이프는 도착하는 데 오랜 시간이 걸렸고 NF 없이 도착하여 변형된 상자에 던져졌고 기구의 품질이 모두 낮았으며 찌그러지고 포크 끝이 구부러진 상태로 도착했습니다.,
af7b1f7080ed76cd6d266c0ce5a13044,Não é da marca Mairibel! ,"Entregaram um produto de outra marca, bem inferior! E no anúncio diz marca MAIRIBEL e a foto do produto é da MAIRIBEL.",다른 브랜드의 제품이 배송되었는데 훨씬 열등하네요!그리고 광고에는 MAIRIBEL이라는 브랜드가 나와 있고 제품 ​​사진은 MAIRIBEL에서 나온 것입니다.,Mairibel 브랜드가 아닙니다!
dca954560c94725cbb8402714b1dc7bd,,"O jogo todo arranhado, envio e-mail reclamação vocês não respondem, não gira no vídeo game. Testado em outro vídeo games .",게임이 완전히 긁혔습니다. 불만을 표시하기 위해 이메일을 보냈지만 귀하는 응답하지 않고 비디오 게임에서 플레이되지 않습니다.다른 비디오 게임에서 테스트되었습니다.,
4456ddfcb3350b652f0318df9b7f3cde,,Comprei o produto em 20/02/2017; o prazo para entrega era até 17/03: hoje é 21/03 e ainda não recebi.,나는 2017년 2월 20일에 제품을 구입했습니다.배송 마감일은 03/17이었습니다. 오늘은 03/21인데 아직 받지 못했습니다.,
a9aef39ca580c8bf9b2bc2e2927ee47f,Regular,"Queria meu pedido conforme ilustrado na figura para mim viria a torneira elétrica conforme a ilustração......
",그림과 같이 주문했는데 전기 탭이 그림과 같이 올 것입니다......,정기적인
484041967269ab057b79f27c33a68f52,,Ainda não recebi o produto é consta no sistema como entregue.,아직 제품을 받지 못했는데 시스템에는 '배송완료'로 표시됩니다.,
4817db123f2751c4c12805d5715a51c5,Produto inferior ,"Produto bem inferior as imagens, a grama veio toda desfiada e soltando as fibras !!!
Só não devolvi pelo urgência em usar.","이미지보다 훨씬 열등한 제품, 잔디가 모두 잘리고 섬유질이 느슨해졌습니다 !!!
급하게 사용해야 한다는 이유로 반품하지 않았습니다.",열등한 제품
ac1436b9efc2d8508c1abf9e4dca5709,,não veio na cor q eu fiz a compra,제가 구매한 색상이 나오지 않네요,
b20687804070fdfcbb7a183e9dd0cc1b,,"Eu comprei esse pendente e antes deles emitorem a NF e postarem eu cancelei pois achei outro que me agradava melhor, e mesmo assim recebi o produto. Acredito que devia ter um controle melhor.",이 펜던트를 구입했는데 송장을 발행하고 게시하기 전에 더 마음에 드는 다른 펜던트를 찾았기 때문에 취소했고 여전히 제품을 받았습니다.나는 통제력을 더 잘 가져야 한다고 생각한다.,
8c9e6ed4aa9e011a36594abdd88d96cf,,"Bom dia !
Estou com um sério problema, pq no site diz que meu quadro foi entregue em 27/02/2018, mas a encomenda não foi recebida na minha casa.
Como proceder? Preciso de ajuda.
","좋은 아침이에요 !
심각한 문제가 있습니다. 웹사이트에 내 그림이 2018년 2월 27일에 배송되었다고 나와 있는데 주문한 그림이 집에 도착하지 않았기 때문입니다.
진행하는 방법?도움이 필요해요.",
cf0c47c42ff868bcd8e038ee2945c1b1,,No site o shampoo esta como 500ml e chegou um de 300ml... Isso e propagana enganosa,홈페이지에는 샴푸가 500ml라고 나와 있는데 300ml가 도착했습니다... 이건 오해의 소지가 있는 광고입니다,
512ba2efae3409f37660ce26199b32aa,,"Não posso! Estou aguardando a chegada do produto que comprei!Logo que isso aconteça, terei minha opinião formada!",난 못해!구매한 제품이 오기를 기다리고 있어요! 그런 일이 발생하자마자 내 의견이 형성될 것입니다!,
45076151b8ea416cffebd82f5013905d,Duvidoso ,"Comprei 2 combos , com 12 unidades , num total de 24 caixas. Efetuei o pagamento de 633,00 à vista. Compreendi que devido à greve , ocorressem atrasos, mas infelizmente chegou um combo com 11 caixas.","저는 2개 콤보, 12개 단위, 총 24개 상자를 구입했습니다.저는 현금으로 633,000원을 지불했습니다.파업으로 인해 배송이 지연될 것으로 알고 있었는데, 아쉽게도 11박스 콤보가 도착했습니다.",못 미더운
d9f834b712ac280bbbbcd7a3114c240c,,Gostaria de sabe pq não venhor o inalador certo perdi um e venhor outro estou tentando fala com o vendendo e não consigo.,올바른 흡입기를 구입하지 못한 이유를 알고 싶습니다. 하나를 잃어버렸는데 다른 하나가 왔습니다. 판매자와 대화하려고 하는데 할 수 없습니다.,
48ea816d75222e26e37782d2ebe2ea5b,Produto com problema,"O produto apresentou problema no cabo de alimentação de energia, o mesmo liga e desliga diversas vezes durante o uso, nem pudemos testar ele na verdade, optamos por devolvê-lo, infelizmente!","제품의 전원 코드에 문제가 있어서 사용 중에 여러 번 켰다가 꺼졌습니다. 심지어 테스트도 할 수 없었고, 사실 안타깝게도 반품하기로 결정했습니다!",문제제품
3f003568147c785083d014edfba38c48,1,MUITO MAU ACABADO NÃO RECOMENDO ,매우 나쁜 마무리 추천하지 않습니다,1
2b80bbe860a78a5c399ce50fd730c376,,"Meu produto não foi entregue ainda, espero que seja! ",내 제품이 아직 배송되지 않았습니다. 배송되었으면 좋겠습니다!,
80856e464d96ed6573219f5d65fc7f3e,,"Quem compra pela internet quer receber o produto
em casa,e não ir entregar produtos via correios
quando o mesmo vem errado.","온라인으로 구매한 사람이라면 누구나 제품을 받고 싶어할 것입니다.
집에서는 우체국을 통해 제품을 배송하지 않습니다.
잘못되었을 때.",
94efba2960b135b735b57b7da59cab23,,"Tive que cancelar a maioria das minhas encomendas, só gostaria de ter sido procurado pela equipe de atendimento não só por e-mail.
Sei que em grande parte da culpa foi dos correios.","대부분의 주문을 취소해야 했습니다. 이메일뿐만 아니라 고객 서비스 팀에서 연락을 받았으면 좋았을 텐데요.
나는 그것이 주로 우편 서비스의 잘못이라는 것을 알고 있습니다.",
b52297c2962cf13981238d8a35c0f62c,,Falta de consideração com o cliente .,고객에 대한 배려가 부족합니다.,
816c0409fb7624265037bcbadc488c2b,Produto alterado,"A placa não é nova, foi alterada e não funciona. Estou muito insatisfeita com a loja lannister, pois o produto veio do mercado livre. 
Quero meu dinheiro de volta.","보드는 새 것이 아니며 변경되어 작동하지 않습니다.나는 제품이 자유 시장에서 나온 것이기 때문에 Lannister 매장에 매우 불만족합니다.
나는 돈을 돌려받고 싶다.",변경된 제품
a47f10b58f94c3040d5db5e91ba8b4ef,,"Minha encomenda chegou antes do prazo estipulado ,porém o produto veio em desacordo com o pedido ,ao invés de vir um cartucho pg 145 preto e um cartuchu pg 146 color ,vieram os doi pg 145 preto . E ag",주문이 규정된 기한 전에 도착했지만 제품이 주문을 준수하지 않았습니다. 검정색 PG 145 카트리지와 PG 146 컬러 카트리지 대신 검정색 PG 145 카트리지 2개가 도착했습니다.그리고 지금,
284a65b124f634fdf426aa8e768fe8ab,,"Comprei para ser presente de natal, porem nao recebi o produto, estou solicitando o reembolso",크리스마스 선물로 구매했는데 상품을 못받았어요 환불요청합니다,
27819e1adc36766f4de3e79fa3b8c04d,,Atraso na entrega nunca é bom sinal. ,배송 지연은 결코 좋은 징조가 아닙니다.,
